{
  "schemaVersion": "1.0",
  "documentType": "PROTOTYPE_CURRICULUM_EXPERIMENT_PROPOSAL",
  "proposalId": "prototype-peer-exchange-2026-09-v2",
  "approvalStatus": "PROPOSED",
  "authority": {
    "proposer": "CODEX_AI_PROPOSER",
    "advisoryReviewer": "ADVERSARIAL_ARCHITECT_REVIEW_ADVISORY_ONLY",
    "finalHumanApprover": "WEBBER_FINAL_HUMAN_CURRICULUM_APPROVER"
  },
  "scope": {
    "experimentType": "FEASIBILITY_PROTOTYPE_ONLY",
    "formalCourseClaim": false,
    "executableLessonsCreated": false,
    "approvedGraphMutated": false,
    "ocacMaterialConsulted": false,
    "contaminationAssessment": "No OCAC lesson, title, target list, sequence, teacher material, or test item was consulted or used. Research was limited to official TBCL/CCCC capability/context references, selected CC-CEDICT item lookups, and TongXuan authority contracts. Non-contamination has not been compared or certified; no later OCAC benchmark is authorized until the TongXuan prototype is frozen.",
    "writingTargets": []
  },
  "licenseNotice": {
    "cedictLicense": "CC BY-SA 4.0",
    "attribution": "CC-CEDICT contributors; item-level lookup distributed through MDBG; CC BY-SA 4.0.",
    "changes": "Selected traditional item forms, Pinyin, and short glosses were normalized into proposal fields. Lesson targets, grammar frames, recognition timing, sequence, and rationales are TongXuan-authored hypotheses. No raw dictionary database, example sentences, test questions, audio, or images are included.",
    "mitAppliesToCedictData": false
  },
  "sourceCatalog": [
    {
      "sourceId": "cc-cedict",
      "status": "GREEN",
      "useMode": "CONTENT_SOURCE",
      "rawDatasetIngested": false,
      "license": "CC BY-SA 4.0",
      "permittedUse": "Selected item-level traditional/simplified forms, Mandarin Pinyin, and basic glosses, with attribution, changes stated, and share-alike maintained.",
      "prohibitedUse": "No raw-dataset ingestion in this proposal; no frequency or sequence claims; never relicense CC-CEDICT-derived data under MIT."
    },
    {
      "sourceId": "tbcl-naer",
      "status": "YELLOW",
      "useMode": "REFERENCE_ONLY",
      "rawDatasetIngested": false,
      "license": null,
      "permittedUse": "Cite broad official beginner receptive/productive capability descriptors and level context.",
      "prohibitedUse": "No copied tables or items; no reuse authorization; does not prescribe these targets, exact wording, or lesson order."
    },
    {
      "sourceId": "tocfl-cccc",
      "status": "YELLOW",
      "useMode": "REFERENCE_ONLY",
      "rawDatasetIngested": false,
      "license": null,
      "permittedUse": "Cite public child-age, child-centered context and broad everyday/leisure topic scope.",
      "prohibitedUse": "No test item, question, answer, audio, image, content, or sequence reuse."
    }
  ],
  "evidenceCatalog": [
    {
      "evidenceId": "ev-tbcl-l1",
      "sourceId": "tbcl-naer",
      "category": "OFFICIAL_LEVEL_FRAMEWORK",
      "reference": "https://coct.naer.edu.tw/page.jsp?ID=11",
      "claim": "TBCL Level 1 describes simple words and phrases for personal life; Listening L-1-3 covers everyday greetings and short phrases; Speaking S-1-2 covers personal information and S-1-3 greetings/thanks. This supports broad capability scope only, not this proposal's exact expressions or sequence.",
      "useMode": "REFERENCE_ONLY",
      "rawContentIncluded": false
    },
    {
      "evidenceId": "ev-tbcl-l2",
      "sourceId": "tbcl-naer",
      "category": "OFFICIAL_LEVEL_FRAMEWORK",
      "reference": "https://coct.naer.edu.tw/page.jsp?ID=12",
      "claim": "TBCL Level 2 describes simple words/phrases and short sentences for daily life; Speaking S-2-2 covers expressing self/friends' interests and interacting; Listening L-2-1 covers personal questions. This supports a possible progression endpoint, not an official five-lesson sequence or required mastery threshold.",
      "useMode": "REFERENCE_ONLY",
      "rawContentIncluded": false
    },
    {
      "evidenceId": "ev-cccc-child-context",
      "sourceId": "tocfl-cccc",
      "category": "CHILD_CONTEXT_REFERENCE",
      "reference": "https://tocfl.edu.tw/tocfl/index.php/test/cccc/list/1",
      "claim": "CCCC is designed for non-native Chinese-speaking children ages 7–12, considers child cognitive/language development, and uses child-life contexts including leisure activities. This informs age/context relevance only; no CCCC task, target order, item, or expected load is copied.",
      "useMode": "REFERENCE_ONLY",
      "rawContentIncluded": false
    },
    {
      "evidenceId": "ev-cedict-license",
      "sourceId": "cc-cedict",
      "category": "OPEN_LEXICAL_ITEM",
      "reference": "https://cc-cedict.org/editor/editor.php?handler=Download",
      "claim": "CC-CEDICT item data is licensed CC BY-SA 4.0. Attribution, change indication, and share-alike apply. This source is not relicensed under TongXuan repository MIT.",
      "useMode": "CONTENT_SOURCE",
      "rawContentIncluded": false
    },
    {
      "evidenceId": "ev-tongxuan-hypothesis",
      "sourceId": "tongxuan-proposal",
      "category": "TONGXUAN_HYPOTHESIS",
      "reference": "https://github.com/webber0612/TongXuan-Chinese/issues/109",
      "claim": "The peer-introduction-to-preference-exchange theme, candidate targets, target load, prerequisites, recycling, and sequence are TongXuan hypotheses. TBCL/CCCC do not mandate them. Frequency evidence is unavailable in the cited lexical source and remains UNVERIFIED.",
      "useMode": "AUTHORED_HYPOTHESIS",
      "rawContentIncluded": false
    },
    {
      "evidenceId": "ev-character-srs-unresolved",
      "sourceId": "tongxuan-proposal",
      "category": "TONGXUAN_HYPOTHESIS",
      "reference": "https://github.com/webber0612/TongXuan-Chinese/issues/109",
      "claim": "Character-level SRS is UNRESOLVED. Character recognition is proposed separately; no character ID is placed in srsReviewTargets because the cited framework and lexical references do not support a character-level review/mastery unit.",
      "useMode": "AUTHORED_HYPOTHESIS",
      "rawContentIncluded": false
    },
    {
      "evidenceId": "ev-lex-nihao",
      "sourceId": "cc-cedict",
      "category": "OPEN_LEXICAL_ITEM",
      "reference": "https://www.mdbg.net/chinese/dictionary?page=worddict&wdqb=%E4%BD%A0%E5%A5%BD",
      "claim": "Manual item lookup supports selected traditional form 你好, Pinyin nǐhǎo, and basic sense 'hello; greeting'. It does not establish learner frequency, child suitability, or instructional order.",
      "useMode": "CONTENT_SOURCE",
      "rawContentIncluded": false
    },
    {
      "evidenceId": "ev-lex-wo",
      "sourceId": "cc-cedict",
      "category": "OPEN_LEXICAL_ITEM",
      "reference": "https://www.mdbg.net/chinese/dictionary?page=worddict&wdqb=%E6%88%91",
      "claim": "Manual item lookup supports selected traditional form 我, Pinyin wǒ, and basic sense 'I; me; my'. It does not establish learner frequency, child suitability, or instructional order.",
      "useMode": "CONTENT_SOURCE",
      "rawContentIncluded": false
    },
    {
      "evidenceId": "ev-lex-jiao",
      "sourceId": "cc-cedict",
      "category": "OPEN_LEXICAL_ITEM",
      "reference": "https://www.mdbg.net/chinese/dictionary?page=worddict&wdqb=%E6%88%91%E5%8F%AB",
      "claim": "Manual item lookup supports selected traditional form 叫, Pinyin jiào, and basic sense 'to be called; to call'. It does not establish learner frequency, child suitability, or instructional order.",
      "useMode": "CONTENT_SOURCE",
      "rawContentIncluded": false
    },
    {
      "evidenceId": "ev-lex-ni",
      "sourceId": "cc-cedict",
      "category": "OPEN_LEXICAL_ITEM",
      "reference": "https://www.mdbg.net/chinese/dictionary?page=worddict&wdqb=%E4%BD%A0",
      "claim": "Manual item lookup supports selected traditional form 你, Pinyin nǐ, and basic sense 'you (informal)'. It does not establish learner frequency, child suitability, or instructional order.",
      "useMode": "CONTENT_SOURCE",
      "rawContentIncluded": false
    },
    {
      "evidenceId": "ev-lex-shenme",
      "sourceId": "cc-cedict",
      "category": "OPEN_LEXICAL_ITEM",
      "reference": "https://www.mdbg.net/chinese/dictionary?page=worddict&wdqb=%E4%BB%80%E9%BA%BC",
      "claim": "Manual item lookup supports selected traditional form 什麼, Pinyin shénme, and basic sense 'what; something'. It does not establish learner frequency, child suitability, or instructional order.",
      "useMode": "CONTENT_SOURCE",
      "rawContentIncluded": false
    },
    {
      "evidenceId": "ev-lex-mingzi",
      "sourceId": "cc-cedict",
      "category": "OPEN_LEXICAL_ITEM",
      "reference": "https://www.mdbg.net/chinese/dictionary?page=worddict&wdqb=%E5%90%8D%E5%AD%97",
      "claim": "Manual item lookup supports selected traditional form 名字, Pinyin míngzi, and basic sense 'name'. It does not establish learner frequency, child suitability, or instructional order.",
      "useMode": "CONTENT_SOURCE",
      "rawContentIncluded": false
    },
    {
      "evidenceId": "ev-lex-xihuan",
      "sourceId": "cc-cedict",
      "category": "OPEN_LEXICAL_ITEM",
      "reference": "https://www.mdbg.net/chinese/dictionary?page=worddict&wdqb=like",
      "claim": "Manual item lookup supports selected traditional form 喜歡, Pinyin xǐhuan, and basic sense 'to like; to be fond of'. It does not establish learner frequency, child suitability, or instructional order.",
      "useMode": "CONTENT_SOURCE",
      "rawContentIncluded": false
    },
    {
      "evidenceId": "ev-lex-qiu",
      "sourceId": "cc-cedict",
      "category": "OPEN_LEXICAL_ITEM",
      "reference": "https://www.mdbg.net/chinese/dictionary?page=worddict&wdqb=%E7%90%83",